{
  "chapter_id": "ch01_the_offer",
  "chapter_index": 1,
  "duration_s": 70,
  "through_line": {
    "type": "case_file",
    "primitive": "spine_panel",
    "close_phase_kinds": ["return_to_map", "chapter_outro"],
    "consistency_keys": ["case_no", "evidence"],
    "label": "The recurring case-file board the story returns to at every chapter close."
  },
  "outgoing_state": {
    "scene_tier": "off_map",
    "year_display": 1929
  },
  "phases": [
    {
      "phase_id": "p_climax",
      "phase_kind": "climax",
      "duration_s": 8,
      "beats": [
        {
          "beat_id": "b_deal",
          "start_anchor": {"phrase": "the handshake", "fallback_absolute_s": 2.0},
          "end_anchor": {"phrase": "sealed it", "fallback_absolute_s": 6.0},
          "layers": [
            {"layer": "L9", "primitive": "gunshot_freeze"}
          ]
        }
      ]
    },
    {
      "phase_id": "p_outro",
      "phase_kind": "chapter_outro",
      "duration_s": 6,
      "beats": [
        {
          "beat_id": "b_spine",
          "intent": "Return to the recurring case-file board; this chapter's evidence card now pinned.",
          "start_anchor": {"phrase": "another file", "fallback_absolute_s": 60.0},
          "end_anchor": {"phrase": "still open", "fallback_absolute_s": 66.0},
          "layers": [
            {
              "layer": "L4",
              "primitive": "spine_panel",
              "params": {
                "active_card": "card_offer",
                "case_no": "MM-0001",
                "evidence": [
                  {"id": "card_offer", "label": "The Offer"},
                  {"id": "card_ledger", "label": "The Ledger"},
                  {"id": "card_alibi", "label": "The Alibi"},
                  {"id": "card_witness", "label": "The Witness"}
                ]
              }
            }
          ]
        }
      ]
    }
  ]
}
