{
  "chapter_id": "ch02_reopen",
  "duration_s": 40,
  "vo_start_offset_in_master_s": 70,
  "outgoing_state": {},
  "phases": [
    {
      "phase_id": "p1",
      "phase_kind": "scene_establish",
      "duration_s": 40,
      "beats": [
        {
          "beat_id": "b01_reopen",
          "shot_scale": "micro",
          "start_anchor": {
            "phrase": "the sealed orders"
          },
          "end_anchor": {
            "phrase": "once again"
          },
          "layers": [
            {
              "layer": "L1",
              "primitive": "face_medium",
              "params": {
                "text": "x"
              }
            }
          ],
          "animation_tier": "2d"
        }
      ]
    }
  ]
}