{
  "chapter_id": "ch01_vault",
  "duration_s": 40,
  "vo_start_offset_in_master_s": 0,
  "outgoing_state": {},
  "phases": [
    {
      "phase_id": "p1",
      "phase_kind": "cold_open",
      "duration_s": 40,
      "beats": [
        {
          "beat_id": "b01_file",
          "shot_scale": "micro",
          "start_anchor": {
            "phrase": "the clerk"
          },
          "end_anchor": {
            "phrase": "the sealed orders"
          },
          "layers": [
            {
              "layer": "L1",
              "primitive": "face_closeup",
              "params": {
                "text": "x"
              }
            }
          ],
          "animation_tier": "2d"
        }
      ]
    }
  ]
}